ticket,reply,content_score,content_explanation,format_score,format_explanation
"Hi, I'd like to check the shipping status of my order #1234.","Sure, you can check your shipping status on our website. Your package is scheduled for delivery tomorrow.",4,"The reply addresses the customer's request and provides a specific delivery date, but lacks direct guidance on how to check the status online.",4,"The response is clear and well-structured, with a professional tone and minimal issues."
"The product I received is defective. I'd like a refund, please.",We're sorry to hear that. Could you please provide a photo of the defect so we can proceed with the return process?,3,The reply acknowledges the defect but does not directly address the refund request or provide clear next steps for obtaining it.,4,"The response is clear and polite, with good structure, but lacks a more professional tone regarding the refund process."
I have a question about how to set up my new device. The instructions are not clear.,"Hello, thanks for contacting us. Please go to Settings > Advanced > Device Setup, and follow the steps. Let me know if you need further help.",3,The reply provides basic guidance but lacks detailed steps or clarity on the setup process.,4,"The response is clear and well-structured, but could benefit from a more professional tone."
"Hello, my account was charged twice. Could you help me fix that?",We've identified the issue and have requested a refund for the second charge. You should see the funds returned within 5-7 business days.,5,Fully addresses the customer's request by confirming the refund and providing a clear timeline for resolution.,5,"Well-written, clear, and professional with a good structure and no errors."
I can't log into my account. It says 'invalid password' even though I'm sure it's correct.,Please reset your password using the 'Forgot Password' link. Let us know if you still encounter issues afterwards.,4,"The reply addresses the issue by suggesting a password reset, but could include more reassurance or troubleshooting steps.",4,"The response is clear and well-structured, with minor improvements possible for warmth and professionalism."
